{
  "title": "Metadados institucionais do IFPR",
  "tipo": "cadastro_institucional",
  "versao": 1,
  "atualizado_em": "2026-04-30",
  "colecoes": [
    {
      "id": "campi-ifpr",
      "title": "Campi do IFPR",
      "tipo_item": "campus",
      "path": "institucional/ifpr/campi/index.json",
      "total_itens": 26
    },
    {
      "id": "processos-seletivos-ifpr",
      "title": "Processos seletivos do IFPR",
      "tipo_item": "processo_seletivo",
      "path": "institucional/ifpr/processos-seletivos/index.json",
      "total_itens": 2
    },
    {
      "id": "referencias-ifpr",
      "title": "Referências institucionais do IFPR",
      "tipo_item": "referencia_institucional",
      "path": "institucional/ifpr/referencias/index.json",
      "total_itens": 1
    },
    {
      "id": "ppcs-ifpr",
      "title": "Projetos Pedagógicos de Curso do IFPR",
      "tipo_item": "ppc",
      "path": "institucional/ifpr/ppcs/index.json",
      "total_itens": 194
    }
  ]
}
